{
  "$schema": "https://json-schema.org/draft/2020-12/schema",
  "$id": "https://specs.opena2a.org/schemas/aap/da-claims-v1.schema.json",
  "title": "AAP Delegation Assertion claim set (AAP-SPEC section 5.3)",
  "description": "Claims of the DA: the CGT claim set plus the RFC 8693 delegation members. `sub` is the delegatee, `act.sub` the delegating agent (nesting `act` expresses a chain, innermost first, per RFC 8693 section 4.1), `max_depth` bounds further delegation, `delegator_atx` embeds the delegator's ATX hash for the audit trail (AAP-SPEC section 5.2). The delegatee scope MUST be a subset of the delegator's scope; subsetting is enforced by the minting broker and re-checked by verifiers — the schema pins presence and form, not the subset relation. Self-contained: duplicates the CGT members rather than $ref-ing them so verification never requires reference resolution. A `not` keyword beside the pattern of `delegator_atx`, of `jti`, of the `type` of an `authorization_details` entry and of `cnf.jkt` rejects a line break, as the `not` keyword of `trust_class` does: under Python's `re.search`, which the jsonschema package uses, `$` also matches before a final line break, so each pattern alone admits a well-formed value followed by one, which an ECMA-262 engine rejects.",
  "type": "object",
  "required": ["iss", "sub", "aud", "scope", "trust_class", "issuer_chain", "trust_level", "act", "max_depth", "delegator_atx", "iat", "exp", "jti"],
  "properties": {
    "iss": {
      "type": "string",
      "minLength": 1
    },
    "sub": {
      "type": "string",
      "pattern": "^did:"
    },
    "aud": {
      "type": "string",
      "minLength": 1
    },
    "scope": {
      "type": "string",
      "minLength": 1
    },
    "trust_class": {
      "type": "string",
      "description": "The ATX capability exercised for this grant (AAP-SPEC section 4.2). The first branch is the capability grammar of AIP section 4.1, copied from that section: a reserved namespace, or a namespace prefixed with the defining organization's domain, then a colon and an action (e.g. `acme.com/orders:read`). The second branch is the legacy `namespace:action` form that claim schema v1 carried before it adopted the AIP grammar; it admits an unreserved bare namespace such as `orders:read`, and v1 keeps accepting it so a value a deployed broker mints stays valid. Dropping the legacy branch requires a new claim schema version. The `not` keyword rejects a line break: under Python's `re.search`, which the jsonschema package uses, `$` also matches before a final line break, so each pattern alone admits `orders:read` followed by one, which an ECMA-262 engine rejects.",
      "anyOf": [
        { "pattern": "^(?:[a-z0-9-]+(?:\\.[a-z0-9-]+)+/)?[a-z][a-z0-9_]*:[a-z][a-z0-9_]*$" },
        { "pattern": "^[a-z0-9_-]+:[a-z0-9_-]+$" }
      ],
      "not": { "pattern": "\\n" }
    },
    "issuer_chain": {
      "type": "array",
      "minItems": 1,
      "items": {
        "type": "string",
        "pattern": "^did:"
      }
    },
    "trust_level": {
      "type": "integer",
      "minimum": 0,
      "maximum": 4
    },
    "act": {
      "$ref": "#/$defs/actor"
    },
    "max_depth": {
      "type": "integer",
      "minimum": 0,
      "description": "Remaining delegation depth; 0 is a terminal delegation (AAP-SPEC 0.5 section 5.3). MUST NOT exceed the delegator's matching peer_agent subDelegationDepth (section 5.4; a verifier check)."
    },
    "delegator_atx": {
      "type": "string",
      "pattern": "^sha256:[0-9a-f]{64}$",
      "not": { "pattern": "\\n" }
    },
    "iat": {
      "type": "integer",
      "minimum": 0
    },
    "exp": {
      "type": "integer",
      "minimum": 0,
      "description": "Expiry, a NumericDate as in the CGT (AAP-SPEC section 4.2). MUST NOT be later than the delegator's `exp`; in a chain (nested `act`) the bound holds link by link, so a DA expires no later than any grant in its chain (section 5.3; a verifier check, made by a verifier that can resolve the delegator's grant)."
    },
    "jti": {
      "type": "string",
      "pattern": "^[0-9a-f]{32}$",
      "not": { "pattern": "\\n" }
    },
    "aap_ver": {
      "type": "integer",
      "minimum": 1
    },
    "authorization_details": {
      "$ref": "#/$defs/authorizationDetails"
    },
    "aap_crit": {
      "$ref": "#/$defs/aapCrit"
    },
    "cnf": {
      "$ref": "#/$defs/cnf"
    },
    "fga_constraints": {
      "type": "string",
      "deprecated": true,
      "description": "DEPRECATED in AAP-SPEC 0.5; replacedBy `authorization_details`. Optional-to-ignore. No implementation minted it as of 2026-09-08."
    }
  },
  "$defs": {
    "authorizationDetails": {
      "type": "array",
      "minItems": 1,
      "description": "RFC 9396 authorization_details typed by the AAP-SPEC section 4.4.1 registry; the wire value of `type` is the registry URI `https://specs.opena2a.org/aap/types/<name>`. In a DA every entry MUST be narrower than or equal to a delegator entry of the same type and no entry may lack a parent (section 5.4); the schema pins presence and form, the attenuation relation is a verifier check. Duplicated from cgt-claims-v1 so the DA schema stays self-contained.",
      "items": {
        "type": "object",
        "required": ["type"],
        "properties": {
          "type": { "type": "string", "pattern": "^https://specs\\.opena2a\\.org/aap/types/[a-z_]+$", "not": { "pattern": "\\n" } },
          "requiresApproval": { "type": "boolean" },
          "locations": { "type": "array", "items": { "type": "string", "minLength": 1 } },
          "actions": { "type": "array", "items": { "type": "string", "minLength": 1 } },
          "datatypes": { "type": "array", "items": { "type": "string", "minLength": 1 } },
          "identifier": { "type": "string", "minLength": 1 },
          "privileges": { "type": "array", "items": { "type": "string", "minLength": 1 } },
          "egressCeiling": { "type": "array", "uniqueItems": true, "items": { "type": "string", "minLength": 1 } },
          "labelCeiling": { "type": "array", "uniqueItems": true, "items": { "type": "string", "minLength": 1 } }
        }
      }
    },
    "aapCrit": {
      "type": "array",
      "minItems": 1,
      "uniqueItems": true,
      "items": { "type": "string", "minLength": 1 }
    },
    "cnf": {
      "type": "object",
      "oneOf": [
        { "required": ["jwk"] },
        { "required": ["jkt"] }
      ],
      "properties": {
        "jwk": { "type": "object", "required": ["kty"] },
        "jkt": { "type": "string", "pattern": "^[A-Za-z0-9_-]{43}$", "not": { "pattern": "\\n" } }
      }
    },
    "actor": {
      "type": "object",
      "required": ["sub"],
      "properties": {
        "sub": {
          "type": "string",
          "pattern": "^did:"
        },
        "act": {
          "$ref": "#/$defs/actor"
        }
      }
    }
  }
}
