{
  "iss": "https://broker.acme.example",
  "sub": "did:opena2a:agent:acme/reporting-bot",
  "aud": "https://api.orders.internal",
  "scope": "orders.read",
  "trust_class": "acme.com/orders:read",
  "issuer_chain": [
    "did:opena2a:authority:opena2a.org"
  ],
  "trust_level": 4,
  "authorization_details": [
    {
      "type": "https://specs.opena2a.org/aap/types/data",
      "locations": [
        "https://api.orders.internal/orders"
      ],
      "actions": [
        "read"
      ],
      "fieldsAllowed": [
        "id",
        "status"
      ],
      "fieldsDenied": [
        "customer.email"
      ],
      "labelCeiling": [
        "internal"
      ]
    },
    {
      "type": "https://specs.opena2a.org/aap/types/budget",
      "maxUses": 10,
      "rate": {
        "max": 10,
        "windowSeconds": 60
      }
    }
  ],
  "aap_crit": [
    "authorization_details",
    "cnf"
  ],
  "cnf": {
    "jkt": "qI__BOccgAhhH9wob_G7gFVHLKIkS4CutvoSx0bMCY8"
  },
  "act": {
    "sub": "did:opena2a:agent:acme/orders-reader"
  },
  "max_depth": 1,
  "delegator_atx": "sha256:2052879dda15b1ca5e60319e3477a4008412bffdaf3c3566c658795a48cab8fd",
  "iat": 1780315200,
  "exp": 1780315500,
  "jti": "d4e5f6a7b8c9012b3c4d5e6f70819203"
}
